<?xml version="1.0" encoding="UTF-8"?>
<c:model 
    xmlns:c="urn:webdetails/com/2012" 
    xmlns:xsi="http://www.w3.org/2001/XMLSchema-instance"
    xsi:schemaLocation="urn:webdetails/com/2012 ../../schema/com_2012.xsd"
    xmlns="http://www.w3.org/1999/xhtml">
    
    <c:complexType name="DiscreteCartesianAxis"
                   space="pvc.options.axes"
                   base="pvc.options.axes.CartesianAxis"
                   abstract="true"
                   use="expanded"
                   facets="pvc.options.axes.DiscreteCartesianAxisFacet">
        <c:documentation>
            The options documentation class of the cartesian axis panel
            for discrete scale type.
            
            For additional information, please see <c:link to="pvc.options.axes.CartesianAxis" />.
        </c:documentation>
        
        <!-- HACK due to kettle cde job limitation -->
        <c:property name="" type="">
        </c:property>
    </c:complexType>
    
    <c:complexType name="FlattenedDiscreteCartesianAxis"
                   space="pvc.options.axes"
                   base="pvc.options.axes.DiscreteCartesianAxis"
                   use="expanded"
                   facets="pvc.options.axes.CartesianAxisTicksFacet">
        <c:documentation>
            The options documentation class of the cartesian axis panel
            for flattened and discrete scale type.
            
            For additional information, please see <c:link to="pvc.options.axes.CartesianAxis" />.
        </c:documentation>
        
        <!-- HACK due to kettle cde job limitation -->
        <c:property name="" type="">
        </c:property>
    </c:complexType>
    
    <c:complexType name="AnyDiscreteCartesianAxis"
                   space="pvc.options.axes"
                   base="pvc.options.axes.DiscreteCartesianAxis"
                   use="expanded"
                   facets="pvc.options.axes.CartesianAxisTicksFacet">
        <c:documentation>
            The options documentation class of the cartesian axis panel
            for discrete scale type.
            
            For additional information, please see <c:link to="pvc.options.axes.CartesianAxis" />.
        </c:documentation>
        
         <c:property name="composite" type="boolean" default="false" category="Discrete > General">
            <c:documentation>
                Indicates if the axis should show 
                discrete multi-dimensional data in 
                a hierarchical form, when <tt>true</tt>,
                or a flattened form, when <tt>false</tt>
                (applies to discrete axes).
                
                Flattened axes, present multi-dimensional roles
                by joining the multiple values with a separator character.
            </c:documentation>
        </c:property>
        
    </c:complexType>
    
    <c:facetType name="DiscreteCartesianAxisFacet" space="pvc.options.axes">
        <c:documentation>
            The options documentation class of the cartesian axis panel
            for discrete scale types.
        </c:documentation>
        
        <c:property name="clickAction" type="pvc.options.varia.StandardAction" category="Discrete > Actions">
            <c:documentation>
                A callback function that is called
                when the user clicks on a tick label
                (applies to discrete axes).
            </c:documentation>
        </c:property>
        
        <c:property name="doubleClickAction" type="pvc.options.varia.StandardAction" category="Discrete > Actions">
            <c:documentation>
                A callback function that is called
                when the user double-clicks on a tick label
                (applies to discrete axes).
            </c:documentation>
        </c:property>
    </c:facetType>
    
</c:model>