<?xml version="1.0" encoding="UTF-8"?>
<c:model 
    xmlns:c="urn:webdetails/com/2012" 
    xmlns:xsi="http://www.w3.org/2001/XMLSchema-instance"
    xsi:schemaLocation="urn:webdetails/com/2012 ../../schema/com_2012.xsd"
    xmlns="http://www.w3.org/1999/xhtml">
    
    <c:space name="pvc.options.plots">
        <c:documentation>
            The namespace of plot options classes. 
        </c:documentation>
    </c:space>
    
    <c:complexType name="PlotCommonOptions" space="pvc.options.plots" abstract="true">
        <c:documentation>
            The common options documentation class of all plots.
        </c:documentation>
        
        <c:property name="valuesVisible" default="false" type="boolean">
            <c:documentation>
                Indicates if value labels are shown next to the visual elements.
                
                Most charts have some form of showing labels
                with the <i>main</i> value next to the visual element.
                
                The default value really varies with the chart type,
                so be sure to confirm it in the most specific plot class.
            </c:documentation>
        </c:property>
        <c:property name="showValues" default="false" type="boolean">
            <c:documentation>
                <c:deprecated>Use <c:link to="#valuesVisible"/> instead.</c:deprecated>
                Indicates if value labels are shown next to the visual elements.
            </c:documentation>
        </c:property>
        <c:property name="valuesAnchor" default="" type="string">
            <c:documentation>
                The alignment of a value label 
                relative to its corresponding visual element position.
                
                The possible values depend on the chart type.
            </c:documentation>
        </c:property>
        
        <!-- 
        ValuesFont
        ValuesMask
        ColorAxis
         -->
    </c:complexType>
    
    <!-- 
    <c:include the="charts/common.xml" />
    
    <c:include the="charts/bullet.xml" />
    
	<c:include the="charts/cartesian-common.xml" />
	
	<c:include the="charts/categorical-common.xml" />
	-->
	<!-- CATEGORICAL
	<c:include the="charts/box.xml" />
	<c:include the="charts/heat-grid.xml" />
	 -->
	<!-- BAR
	<c:include the="charts/bar-common.xml" />
	<c:include the="charts/bar.xml" />
	<c:include the="charts/bar-normalized.xml" />
	<c:include the="charts/waterfall.xml" />
	 -->
	<!-- POINT
	<c:include the="charts/point-common.xml" />
    <c:include the="charts/line.xml" />
    <c:include the="charts/line-stacked.xml" />
    <c:include the="charts/dot.xml" />
    <c:include the="charts/dot-stacked.xml" />
    <c:include the="charts/area.xml" />
    <c:include the="charts/area-stacked.xml" />
    -->
	<!-- METRIC POINT
	<c:include the="charts/point-metric-common.xml" />
	<c:include the="charts/line-metric.xml" />
	<c:include the="charts/dot-metric.xml" />
	 -->
</c:model>