<?xml version="1.0" encoding="UTF-8"?>
<c:model 
    xmlns:c="urn:webdetails/com/2012" 
    xmlns:xsi="http://www.w3.org/2001/XMLSchema-instance"
    xsi:schemaLocation="urn:webdetails/com/2012 ../../schema/com_2012.xsd"
    xmlns="http://www.w3.org/1999/xhtml">
    
    <c:complexType name="DiscreteCartesianAxisOptions" 
                   space="pvc.options.panels" 
                   base="pvc.options.panels.CartesianAxisOptions">
        <c:documentation>
            The options documentation class of the cartesian axis panel
            for discrete scale types.
            
            For more information about cartesian axes 
            please see the comments in the base class
            <c:link to="pvc.options.panels.CartesianAxisOptions" />.
            
            For more information on a specific
            type of discrete axis,   
            please see:
            <c:link to="pvc.options.panels.FlattenedCartesianAxisOptions" />
            and
            <c:link to="pvc.options.panels.HierarchicalCartesianAxisOptions" />.
        </c:documentation>
        
        <c:property name="composite" type="boolean" default="false" category="General">
            <c:documentation>
                Indicates if the axis should show 
                discrete multi-dimensional data in 
                a hierarchical form, when <tt>true</tt>,
                or a flattened form, when <tt>false</tt>.
            </c:documentation>
        </c:property>
        
        <c:property name="clickAction" type="pvc.options.varia.StandardAction" category="Actions">
            <c:documentation>
                A callback function that is called
                when the user clicks on a tick label.
            </c:documentation>
        </c:property>
        
        <c:property name="doubleClickAction" type="pvc.options.varia.StandardAction" category="Actions">
            <c:documentation>
                A callback function that is called
                when the user double-clicks on a tick label.
            </c:documentation>
        </c:property>
    </c:complexType>
    
</c:model>